{"$id":"https://kody-w.github.io/rapp-hive-hub/api/hive-hub/v1/schemas/protocol-declaration.schema.json","$schema":"https://json-schema.org/draft/2020-12/schema","additionalProperties":true,"properties":{"$schema":{"format":"uri","pattern":"^https://","type":"string"},"kind":{"const":"protocol-declaration"},"mediaTypes":{"items":{"minLength":1,"type":"string"},"minItems":1,"type":"array"},"protocolId":{"minLength":1,"type":"string"},"semantics":{"type":"object"},"transport":{"type":"object"},"version":{"minLength":1,"type":"string"}},"required":["$schema","kind","mediaTypes","protocolId","semantics","transport","version"],"title":"Hive Hub protocol declaration","type":"object"}
